	5gram	freq	pmi
252	зависимый_a тогда_adv только_part тогда_adv когда_conj	4	31.043994026121347
253	форма_s аналитический_a геометрия_s линейный_a алгебра_s	4	26.503057502772776
254	такой_a что_conj аналитический_a геометрия_s линейный_a	4	23.177312825277273
255	аналитический_a геометрия_s линейный_a алгебра_s свойство_s	4	25.645076507645204
256	формула_s аналитический_a геометрия_s линейный_a алгебра_s	4	25.67650901548186
257	плоскость_s аналитический_a геометрия_s линейный_a алгебра_s	4	25.138922847764725
258	матрица_s переход_s от_pr один_a ортонормированный_a	4	27.361814474037327
259	базис_s аналитический_a геометрия_s линейный_a алгебра_s	4	25.231594474868402
260	иметь_v вид_s аналитический_a геометрия_s линейный_a	4	24.088148954833834
261	равный_a нуль_s одновременно_adv число_s такой_a	4	27.384298092582966
262	аналитический_a геометрия_s линейный_a алгебра_s следствие_s	4	27.68287854035759
263	определение_s линия_s уравнение_s который_a в_pr	4	21.03254399455953
264	по_pr теорема_s о_pr базисный_a минор_s	4	29.910554408599594
265	координатный_a представление_s элемент_s в_pr базис_s	4	25.422072669462526
266	однородный_a система_s линейный_a уравнение_s задавать_partcp	4	27.55444033541303
267	действие_s с_pr линейный_a оператор_s в_pr	4	22.93686843451105
268	матрица_s билинейный_a функционал_s зависеть_v от_pr	4	31.991501833643156
269	билинейный_a функционал_s зависеть_v от_pr выбор_s	4	36.23379381241731
270	функционал_s зависеть_v от_pr выбор_s базис_s	4	32.54729328523409
271	который_a квадратичный_a функционал_s иметь_v диагональный_a	4	28.877910256766118
272	соответственно_adv к_pr канонический_a диагональный_a вид_s	4	32.77774810217896
273	квадратичный_a функционал_s к_pr диагональный_a вид_s	4	29.705701813323408
274	центральный_a симметрия_s относительно_adv начало_s координата_s	4	42.45678656090603
275	теорема_s пусть_part быть_v точка_s принадлежать_partcp	4	25.874369073778038
276	аналитический_a геометрия_s линейный_a алгебра_s приложение_s	4	28.415594661522434
277	поверхность_s задавать_partcp в_pr некоторый_a ортонормиро_s	4	34.49891870705297
278	задавать_partcp в_pr некоторый_a ортонормиро_s прил_s	4	34.49891870705297
279	прил_s ванный_a система_s координата_s уравнение_s	4	29.242801730020815
280	система_s координата_s уравнение_s вид_s называться_v	4	21.539085925876257
281	поверхность_s поскольку_conj из_pr его_a канонический_a	4	29.92055161550871
282	поскольку_conj из_pr его_a канонический_a уравнение_s	4	26.47215264080458
283	его_a канонический_a уравнение_s следовать_v что_conj	4	25.497964151973907
284	тензор_s если_conj в_pr каждый_a базис_s	4	22.48139293610795
285	лекция_s основной_a общематематический_a понятие_s обозначение_s	3	40.65760576364921
286	если_conj любой_a элемент_s множество_s являться_v	3	22.704040247386597
287	подписать_partcp в_pr печать_s формат_s бумага_s	3	48.74333563767509
288	в_pr печать_s формат_s бумага_s офсетный_a	3	48.421407542787726
289	комплексный_a число_s комплексно_adv сопряженный_a число_s	3	31.621591586012126
290	метод_s математический_a индукция_s аксиома_s индукция_s	3	37.137836172084704
291	из_pr предположение_s что_conj утверждение_s верно_adv	3	31.355136410387725
292	предположение_s что_conj утверждение_s верно_adv для_pr	3	31.39533139409423
293	вытекать_v о справедливость_s для_pr утверждение_s	3	34.432155549352494
294	о справедливость_s для_pr утверждение_s верно_adv	3	33.97758968588701
295	справедливость_s для_pr утверждение_s верно_adv для_pr	3	32.05993265940942
296	для_pr утверждение_s верно_adv для_pr весь_a	3	28.073254037907255
297	мочь_v быть_v единственный_a образ_s представить_partcp	3	33.020871410248326
298	доказать_v что_conj при_pr любой_a натуральный_a	3	23.278113627423124
299	число_s можно_adv представить_v в виде_pr	3	27.579576610495003
300	из_pr он можно_adv выбрать_v такой_a	3	26.30535491516153
301	он можно_adv выбрать_v такой_a число_s	3	25.603872410534205
302	можно_adv выбрать_v такой_a число_s что_conj	3	23.96584086562292
303	принцип_s дирихля_s размещение_s перестановка_s сочетание_s	3	46.010670180942505
304	б_part доказать_v что_conj для_pr любой_a	3	21.979590776791643
305	разложение_s по_pr формула_s бином_s ньютон_s	3	35.640143133229266
306	во_pr весь_a зоопарк_s где_adv быть_v	3	32.74582905335669
307	сколько_adv существовать_v целый_a число_s от_pr	3	27.693157445491863
308	существовать_v целый_a число_s от_pr до_pr	3	26.445229932048278
309	целый_a число_s от_pr до_pr который_a	3	25.285170283732167
310	делиться_v ни_conj на_pr ни_part на_pr	3	31.312567707187974
311	фигура_s площадь_s общий_a часть_s кото_s	3	38.45179355586348
312	площадь_s общий_a часть_s кото_s рых_s	3	40.58929707961342
313	евклид_s основной_a теорема_s арифметика_s простой_a	3	34.34321134144726
314	основной_a теорема_s арифметика_s простой_a число_s	3	28.90858311381053
315	быть_v по крайней мере_adv один_a	3	37.87934906318813
316	число_s алгоритм_s евклид_s основной_a теорема_s	3	30.233678487776572
317	делиться_v на_pr доказать_v что_conj число_s	3	20.190701154438162
318	уравнение_s иметь_v решение_s в_pr целый_a	3	20.06806212442188
319	число_s в_pr фибоначчиева_s система_s счисление_s	3	29.772668390474546
320	доказать_v что_conj хотя_part бы_part один_a	3	32.274403281120634
321	доказать_v что_conj если_conj простой_s число_s	3	23.492189599016903
322	найти_v остаток_s от_pr деление_s на_pr	3	28.063376482257635
323	пусть_part простой_s число_s доказать_v что_conj	3	24.780284098828393
324	система_s вычет_s по_pr модуль_s соответственно_adv	3	32.29113030137982
325	что_conj доказать_v что_conj при_pr любой_a	3	19.41979424950031
326	натуральный_a число_s попарно_adv взаимно_adv простой_a	3	33.60747695740727
327	число_s дробь_s система_s счисление_s рациональный_a	3	29.08020539305629
328	дробь_s система_s счисление_s рациональный_a иррациональный_a	3	34.433913625309444
329	система_s счисление_s рациональный_a иррациональный_a число_s	3	31.253041989918504
330	за_pr взвешивание_s на_pr двухчашечный_a весы_s	3	42.6295934716259
331	взвешивание_s на_pr двухчашечный_a весы_s без_pr	3	43.87752098506949
332	на_pr двухчашечный_a весы_s без_pr гиря_s	3	43.555592890182126
333	двухчашечный_a весы_s без_pr гиря_s найти_v	3	45.78320302078959
334	весы_s без_pr гиря_s найти_v фальшивый_a	3	44.19824052006844
335	без_pr гиря_s найти_v фальшивый_a монета_s	3	43.297776193619356
336	давать_v остаток_s при_pr деление_s на_pr	3	29.76128944864519
337	теорема_s о_pr рациональный_a корень_s многочлен_s	3	28.056696136049457
338	доказать_v что_conj при_pr многочлен_s делиться_v	3	23.33439490043214
339	что_conj при_pr многочлен_s делиться_v на_pr	3	21.977447302311077
340	при_pr многочлен_s делиться_v на_pr доказать_v	3	23.471289535084523
341	квадратный_a корень_s из_pr комплексный_a число_s	3	24.44655714407445
342	прямой_a проходить_partcp через_pr начало_s координата_s	3	31.98358683475514
343	алгебра_s геометрия_s геометрия_s помогать_v алгебра_s	3	33.199413554663806
344	что_conj точка_s лежать_v на_pr один_a	3	22.100608770510135
345	уравнение_s система_s уравнение_s третий_a степень_s	3	24.18849624016992
346	изобразить_v на_pr фазовый_a плоскость_s множество_s	3	32.24036783565502
347	фазовый_a плоскость_s множество_s точка_s для_pr	3	25.6122442947613
348	плоскость_s множество_s точка_s для_pr который_a	3	20.708792783119552
349	доказать_v что_conj при_pr решение_s уравнение_s	3	18.80979107815617
350	хотя бы_adv один_a из_pr число_s	3	28.24697111155366
351	принимать_v целый_a значение_s в_pr точка_s	3	24.40709849515414
352	найти_v формула_s го_s член_s для_pr	3	28.586347689167734
353	мочь_v быть_v переписать_partcp в виде_pr	3	33.31081074941443
354	если_conj если_conj если_conj решение_s нет_adv	3	23.684845268494275
355	между_pr средний_a арифметический_a средний_a геометрический_a	3	37.81291657466881
356	арифметический_a средний_a геометрический_a воспользоваться_v неравенство_s	3	35.67251066014656
357	воспользоваться_v неравенство_s между_pr среда_s о	3	35.19419980523845
358	между_pr средний_a арифметич_s ские_s средний_a	3	44.67648340399232
359	касательная_s к_pr график_s функция_s в_pr	3	26.177605754867034
360	к_pr график_s функция_s в_pr точка_s	3	21.787310329673485
361	школа_s в_pr математика_s арифметика_s алгеб_sк_pr	3	38.73089192087026
362	в_pr математика_s арифметика_s алгеб_sк_pr журнал_s	3	38.91851892404603
363	система_s иметь_v бесконечный_a множество_s решение_s	3	24.75764678290209
364	достаточно_adv чтобы_conj ранг_s он основной_a	3	32.85364830801338
365	тогда_adv только_part тогда_adv когда_conj существовать_v	3	27.80613019602246
366	вектор_s на_pr косинус_s угол_s между_pr	3	29.235609607780255
367	площадь_s параллелограмм_s построить_partcp на_pr вектор_s	3	32.7176834280722
368	матрица_s линейный_a оператор_s в_pr базис_s	3	19.193318462871655
369	зависеть_v от_pr выбор_s базис_s доказательство_s	3	31.95200625478539
370	базис_s состоять_partcp из_pr собственный_a вектор_s	3	27.073815491429716
371	переход_s от_pr один_a система_s координата_s	3	25.306670982302467
372	уравнение_s прямой_a проходить_partcp через_pr точка_s	3	26.330482827891963
373	найти_v расстояние_s от_pr точка_s до_pr	3	28.350258915824302
374	называться_v множество_s точка_s на_pr плоскость_s	3	20.108894377235686
375	фокус_s провести_v ось_s через_pr фокус_s	3	38.15592450317133
376	начало_s координата_s взять_v в_pr середина_s	3	33.04786717079014
377	координата_s взять_v в_pr середина_s отрезок_s	3	31.44972928132125
378	курс_s аналитический_a геометрия_s линейный_a алгебра_s	3	28.157282665931046
379	математика_s для_pr экономист_s учебный_a пособие_s	3	40.75992945178366
380	допустимый_a значение_s выражение_s с_pr переменный_a	3	29.709610868047243
381	произведение_s сумма_s число_s на_pr их_a	3	23.048476119131536
382	число_s на_pr их_a неполный_a квадрат_s	3	29.66015190315711
383	что_s называться_v область_s допустимый_a значение_s	3	30.436196499595752
384	который_a обращать_v уравнение_s в_pr верный_a	3	27.971031435062386
385	если_conj множество_s их_a решение_s совпадать_v	3	26.649241818509967
386	из_pr левый_a часть_s в_pr правый_a	3	26.799736671069418
387	левый_a часть_s в_pr правый_a часть_s	3	29.194403122927607
388	часть_s уравнение_s на_pr м получить_v	3	23.156789130188123
389	линейный_a уравнение_s с_pr один_a неизвестное_s	3	24.92183216317481
390	на_pr м получить_v эквивалентный_a уравнение_s	3	24.786317183342724
391	система_s уравнение_s пусть_part например_adv дан_s	3	26.42200247593825
392	уравнение_s пусть_part например_adv дан_s система_s	3	26.42200247593825
393	метод_s решение_s система_s линейный_a уравнение_s	3	20.89635736126191
394	линейный_a уравнение_s с_pr неизвестный_a иметь_v	3	21.53284689707529
395	таким образом_adv м доказать_v что_conj	3	27.445359901686334
396	чем_conj сущность_s метод_s подстановка_s в_pr	3	33.56895164878634
397	сущность_s метод_s подстановка_s в_pr чем_conj	3	33.56895164878634
398	метод_s подстановка_s в_pr чем_conj сущность_s	3	33.56895164878634
399	сколько_adv корень_s иметь_v квадратный_a уравнение_s	3	26.925336059041314
400	корень_s иметь_v квадратный_a уравнение_s если_conj	3	22.398836819904748
401	иметь_v квадратный_a уравнение_s если_conj его_a	3	23.064682422684125
402	квадратный_a уравнение_s если_conj его_a дискриминант_s	3	28.936587660343314
403	неравенство_s тот_aсмысл_s пусть_part например_adv дать_partcp	3	34.07103355031462
404	тот_aсмысл_s пусть_part например_adv дать_partcp неравенство_s	3	34.07103355031462
405	если_conj где_adv во_pr множество_s положительный_a	3	27.241234153996675
406	где_adv во_pr множество_s положительный_a число_s	3	26.632665447355425
407	пример_s решить_v нелинейный_a уравнение_s по_pr	3	27.83935913408035
408	решить_v нелинейный_a уравнение_s по_pr определение_s	3	26.700688538641412
409	нелинейный_a уравнение_s по_pr определение_s модуль_s	3	26.932014084747866
410	тогда_adv данный_a уравнение_s принимать_v вид_s	3	25.54916119970729
411	уравнение_s в качестве_pr пример_s решить_v	3	28.6089775931135
412	метод_s приведение_s к_pr один_a основание_s	3	32.75869364919931
413	введение_s в_pr математический_a анализ_s лекция_s	3	32.34421741068389
414	замена_s переменная_s интегрирование_s по_pr часть_s	3	31.29043567708295
415	лекция_s дифференциальный_a уравнение_s порядок_s лекция_s	3	26.8973044014928
416	дифференциальный_a уравнение_s порядок_s лекция_s дифференциальный_a	3	27.29108278139984
417	уравнение_s порядок_s лекция_s дифференциальный_a уравнение_s	3	23.91345688110909
418	порядок_s с_pr постоянный_a коэффициент_s лекция_s	3	29.373042061846434
419	уравнение_s порядок_s с_pr постоянный_a коэффициент_s	3	26.389194541462725
420	лекция_s матрица_s действие_s над_pr он	3	32.23048201629108
421	леиций_s у_pr равнение_s плоскость_s прямой_a	3	32.51364571580181
422	уравнение_s плоскость_s прямой_a задача_s пусть_part	3	22.277164062559343
423	плоскость_s прямой_a задача_s пусть_part плоскость_s	3	23.845244159519673
424	прямой_a задача_s пусть_part плоскость_s задать_partcp	3	25.887450719640366
425	расстояние_s от_pr плоскость_s до_pr начало_s	3	31.38918515998254
426	от_pr плоскость_s до_pr начало_s координата_s	3	28.609953838839324
427	леиций_s непрерывность_s функция_s ее_a разрыв_s	3	35.13585587458192
428	он иметь_v производная_s в_pr точка_s	3	21.423514873163647
429	иметь_v в_pr точка_s локальный_a экстремум_s	3	25.650280270246373
430	непрерывный_a на_pr отрезок_s дифференцировать_partcp на_pr	3	25.887901506711348
431	на_pr отрезок_s дифференцировать_partcp на_pr интервал_s	3	27.76002668415919
432	замечание_s равить_v лоииталя_s можно_adv нрименять_v	3	47.14425375819551
433	задача_s свести_v неопределенность_s к_pr неопределенность_s	3	39.298032734265135
434	наити_s наибольший_a наименьший_a значение_s функция_s	3	31.92155899280143
435	леиций_s вынуклость_s точка_s нерегиб_s асимнтот_s	3	45.11010730095182
436	леиций_s о_pr другой_a метод_s интегральный_a	3	32.57289395798749
437	у_pr с_pr у_pr с_pr у_pr	3	22.19686989008877
438	задача_s свести_v дифференциальный_a уравнение_s порядок_s	3	29.15198717173418
439	на_pr лекция_s м познакомиться_v с_pr	3	29.871252258377613
440	линейный_a однородный_a дифференциальный_a уравнение_s го_s	3	27.78030923096566
441	решение_s метод_s вариация_s произвольный_a постоянный_a	3	35.35605506991539
442	метод_s вариация_s произвольный_a постоянный_a решение_s	3	35.35605506991539
443	решение_s при_pr специальный_a вид_s правый_a	3	29.984840602491726
444	при_pr специальный_a вид_s правый_a часть_s	3	31.60947971741669
445	записаться_v общий_a решение_s система_s если_conj	3	27.998027984034486
446	линейный_a осциллятор_s без_pr тре_s ния_s	3	43.289832911111766
447	предел_s функция_s в_pr точка_s если_conj	3	18.575024220296278
448	ряд_s пример_s исследовать_v на_pr сходимость_s	3	28.577909505702827
449	согласно_pr онределение_s предел_s носледовательность_s при_pr	3	38.72106933569495
450	сходиться_v тогда_adv из_pr нризнак_s сравнение_s	3	31.224622550292064
451	ряд_s расходиться_v тогда_adv из_pr нризнак_s	3	30.192290295831164
452	расходиться_v тогда_adv из_pr нризнак_s сравнение_s	3	32.7308079376291
453	леиций_s ряд_s дирихля_s знаконеременный_a ряд_s	3	37.29603416017081
454	тогда_adv из_pr нризнак_s сравнение_s согласно_pr	3	31.80590939286982
455	ряд_s из_pr модуль_s его_a слагаемое_s	3	29.35161107053653
456	функция_s с_pr нериод_s равный_a вопрос_s	3	28.969262131785673
457	корень_s петь_v степень_s мнимый_a единица_s	3	39.357913521011724
458	в_pr остальной_a случай_s см таблица_s	3	29.682386363649144
459	любой_a элемент_s множество_s являться_v элемент_s	3	23.65878684301962
460	элемент_s множество_s являться_v элемент_s множество_s	3	23.14362130925323
461	равный_a тогда_adv только_part тогда_adv когда_conj	3	26.986189574598484
462	те множество_s весь_a вещественный_a число_s	3	27.107911928027836
463	множество_s весь_a вещественный_a число_s удовлетворять_partcp	3	28.873446674390813
464	множество_s если_conj в_pr любой_a окрестность_s	3	22.551931836202996
465	если_conj в_pr любой_a окрестность_s точка_s	3	21.517117065607835
466	в_pr любой_a окрестность_s точка_s найтись_v	3	25.399760114969677
467	предельный_a точка_s множество_s если_conj в_pr	3	22.26218730432257
468	наименьший_a из_pr весь_a верхний_a грань_s	3	33.17541395185334
469	для_pr любой_a найтись_v такой_a что_conj	3	24.138171820500762
470	а_s а_s т_s о_s взять_v	3	32.079888029641346
471	следствие_s о_pr а_s а_s т_s	3	30.463390757044664
472	разделить_v отрезок_s пополам_adv рассмотреть_v его_a	3	36.660094708888806
473	отрезок_s пополам_adv рассмотреть_v его_a половинка_s	3	39.68984205228286
474	возможный_a случай_s в_pr каждый_a из_pr	3	24.56801785435314
475	случай_s в_pr каждый_a из_pr отрезок_s	3	21.983055353631986
476	в_pr каждый_a из_pr отрезок_s лежать_v	3	24.35480256992799
477	каждый_a из_pr отрезок_s лежать_v бесконечный_a	3	30.0131948528606
478	бесконечный_a число_s элемент_s множество_s в_pr	3	21.682108227146657
479	число_s элемент_s множество_s в_pr один_a	3	18.654972097209143
480	элемент_s множество_s в_pr один_a из_pr	3	19.356454601836468
481	множество_s в_pr один_a из_pr отрезок_s	3	20.561885031094196
482	в_pr один_a из_pr отрезок_s лежать_v	3	23.795375161313974
483	один_a из_pr отрезок_s лежать_v бесконечный_a	3	29.45376744424658
484	бесконечный_a число_s элемент_s множество_s первый_a	3	25.07063407076304
485	число_s элемент_s множество_s первый_a случай_s	3	22.79321423701519
486	левый_a отрезок_s обозначить_v о во_pr	3	33.785028173660095
487	отрезок_s обозначить_v о во_pr второй_a	3	31.320747155361406
488	обозначить_v о во_pr второй_a случай_s	3	31.10586878768226
489	о во_pr второй_a случай_s выбрать_v	3	31.48438041093599
490	во_pr второй_a случай_s выбрать_v тот_a	3	32.9048314064012
491	второй_a случай_s выбрать_v тот_a отрезок_s	3	31.38399924309976
492	случай_s выбрать_v тот_a отрезок_s который_a	3	30.477323830583725
493	выбрать_v тот_a отрезок_s который_a содержать_v	3	32.908777293004
494	тот_a отрезок_s который_a содержать_v бесконечный_a	3	32.51188714043542
