	5gram	freq	pmi
495	отрезок_s который_a содержать_v бесконечный_a число_s	3	28.432101630158787
496	который_a содержать_v бесконечный_a число_s элемент_s	3	27.226671200901063
497	бесконечный_a число_s элемент_s множество_s его_a	3	25.755538009358105
498	число_s элемент_s множество_s его_a обозначить_v	3	25.773916538672957
499	элемент_s множество_s его_a обозначить_v таким	3	30.12762477092612
500	множество_s его_a обозначить_v таким образом_adv	3	32.918017700905004
501	его_a обозначить_v таким образом_adv м	3	33.893355646670734
502	обозначить_v таким образом_adv м получить_v	3	33.20089831364404
503	если_conj существовать_v число_s такой_a что_conj	3	19.890882459504184
504	из_pr условие_s следовать_v что_conj из_pr	3	21.026144529550532
505	условие_s следовать_v что_conj из_pr условие_s	3	22.776735387019343
506	означать_v что_conj свойство_s если_conj последовательность_s	3	24.82365103532595
507	что_conj свойство_s если_conj последовательность_s сходиться_v	3	23.700794287540415
508	свойство_s если_conj последовательность_s сходиться_v сходиться_v	3	27.14407616618438
509	если_conj последовательность_s сходиться_v сходиться_v последовательность_s	3	27.66220715842733
510	последовательность_s о_s а_s а_s т_s	3	30.26359998281373
511	найтись_v номер_s такой_a что_conj при_pr	3	27.067291200662904
512	теорема_s больцано_s вейерштрасса_s для_pr последовательность_s	3	34.48794878481192
513	поставить_partcp в_pr соответствие_s единственный_a элемент_s	3	31.22718466478981
514	определение_s предел_s функция_s по_pr гейне_s	3	27.84087978744521
515	из_pr определение_s предел_s по_pr коши_s	3	25.715987963124636
516	определение_s пусть_part функция_s определить_partcp на_pr	3	23.2426062292649
517	в_pr точка_s тогда_adv только_part тогда_adv	3	20.972228119353293
518	точка_s тогда_adv только_part тогда_adv когда_conj	3	25.87911871496181
519	существовать_v такой_a что_conj при_pr все_s	3	25.14247869705712
520	бесконечно_adv малый_a функция_s при_pr если_conj	3	26.28338898684782
521	если_conj бесконечно_adv малый_a функция_s при_pr	3	26.28338898684782
522	при_pr о_pr а_s а_s т_s	3	27.21344877498303
523	а_s а_s т_s о_s следовать_v	3	30.139925612427174
524	а_s т_s о_s следовать_v из_pr	3	27.996359018209297
525	теорема_s если_conj функция_s непрерывный_a в_pr	3	19.702764154807486
526	некоторый_a окрестность_s точка_s функция_s определить_partcp	3	27.24956268363346
527	окрестность_s точка_s функция_s определить_partcp в_pr	3	23.810951608580762
528	в_pr точка_s о_pr а_s а_s	3	22.618425481507426
529	функция_s непрерывный_a на_pr отрезок_s он	3	23.383413867776376
530	на_pr о о_pr а_s а_s	3	25.661526259987834
531	о о_pr а_s а_s т_s	3	28.807836288493455
532	о_pr к_pr з_s т_s о_pr	3	32.691218972990235
533	теорема_s если_conj функция_s непрерывный_a на_pr	3	20.743840097810402
534	те существовать_v такой_a что_conj для_pr	3	24.26424142366664
535	теорема_s пусть_part функция_s определить_partcp непрерывный_a	3	26.120141671563943
536	функция_s определить_partcp непрерывный_a на_pr возрастать_v	3	30.336806245705336
537	определить_partcp непрерывный_a на_pr возрастать_v если_conj	3	30.137859650650014
538	непрерывный_a на_pr возрастать_v если_conj убывать_v	3	32.970749664814754
539	на_pr возрастать_v если_conj убывать_v если_conj	3	30.123730525183635
540	быть_v бесконечно_adv малый_a функция_s при_pr	3	26.74110994799897
541	бесконечно_adv малый_a функция_s при_pr отсюда_adv	3	29.976998211819648
542	бесконечно_adv малый_a более_adv высокий_a порядок_s	3	38.11445378601283
543	малый_a более_adv высокий_a порядок_s чем_conj	3	38.51111275597682
544	функция_s называться_v дифференцировать_partcp в_pr точка_s	3	21.225415846120946
545	т_s о_s е_s о_pr х_s	3	34.12996477066588
546	о_s е_s о_pr х_s о_pr	3	33.44532021162976
547	функция_s теорема_s пусть_part функция_s определить_partcp	3	23.472069126988146
548	функция_s иметь_v в_pr точка_s производная_s	3	20.515922406930297
549	теорема_s пусть_part функция_s непрерывный_a на_pr	3	22.03193459762189
550	а_s т_s о_s провести_v для_pr	3	30.976516419129972
551	тогда_adv справедливый_a формула_s тейлор_s где_adv	3	30.66230431304382
552	остаточный_a член_s в_pr форма_s пеано_s	3	36.95263805957109
553	переменный_a определение_s пусть_part функция_s определить_partcp	3	26.192159763420925
554	что_conj функция_s иметь_v в_pr точка_s	3	16.40044518951036
555	экстремум_s если_conj точка_s являться_v точка_s	3	22.72521353127135
556	а_s а_s т_s о_s так	3	31.393996620069405
557	а_s т_s о_s так как_conj	3	30.98011189355736
558	о_pr к_pr з_s т_s о_s	3	34.01109923922875
559	отрезок_s он интегрировать_partcp на_pr отрезок_s	3	27.738722178254996
560	интеграл_s с_pr переменный_a верхний_a предел_s	3	29.152702056512233
561	существовать_v такой_a что_conj для_pr все_s	3	24.819209184089956
562	тогда_adv только_part тогда_adv когда_conj его_a	3	28.468133732507443
563	называться_v предел_s функция_s в_pr точка_s	3	19.318525250512426
564	а_s т_s о_s по_pr определение_s	3	27.44082137653333
565	в_pr некоторый_a окрестность_s точка_s если_conj	3	21.921333071633168
566	теорема_s пусть_part функция_s определить_partcp в_pr	3	21.83744873995968
567	найти_v частный_a производный_a по_pr от_pr	3	27.514667687586172
568	точка_s являться_v точка_s локальный_a экстремум_s	3	28.0817877689656
569	а_s а_s т_s о_pr записать_v	3	30.611144377488355
570	в_pr точка_s функция_s иметь_v локальный_a	3	22.28851191082722
571	е_s найти_v экстремум_s функция_s если_conj	3	25.745299178087397
572	ряд_s расходиться_v о_s а_s а_s	3	30.812331709448824
573	расходиться_v о_s а_s а_s т_s	3	32.494925528920184
574	если_conj при_pr некоторый_a ряд_s сходиться_v	3	23.90555322870541
575	сходиться_v если_conj ряд_s расходиться_v если_conj	3	25.86421243332451
576	если_conj ряд_s расходиться_v если_conj ряд_s	3	24.021541398367187
577	если_conj ряд_s мочь_v как_conj сходиться_v	3	25.364880004129056
578	ряд_s мочь_v как_conj сходиться_v так	3	28.681925877636672
579	мочь_v как_conj сходиться_v так расходиться_v	3	32.03078229993103
580	как_conj сходиться_v так расходиться_v о_pr	3	32.00180323295927
581	сходиться_v так расходиться_v о_pr а_s	3	32.41568795947131
582	так расходиться_v о_pr а_s а_s	3	31.740378956653903
583	е_s найти_v область_s сходимость_s ряд_s	3	29.20641614371522
584	относительно_pr ось_s координата_s момент_s инерция_s	3	38.70454863715651
585	функция_s непрерывный_a вместе_adv со_pr свой_a	3	35.1191599876181
586	направление_s от_pr точка_s к_pr точка_s	3	24.414247475239264
587	криволинейный_a интеграл_s зависеть_v от_pr путь_s	3	35.37488601568852
588	интеграл_s зависеть_v от_pr путь_s интегрирование_s	3	35.150012604848314
589	екатеринбург_s издво_s урал унт_s с_pr	3	48.9091141097648
590	по_pr аналитический_a геометрия_s линейный_a алгебра_s	3	24.17064792401709
591	соответствен аналитический_a геометрия_s линейный_a алгебра_s	3	29.503057502772773
592	сложение_s умножение_s на_pr вещественный_a число_s	3	28.4457989856936
593	рис_s аналитический_a геометрия_s линейный_a алгебра_s	3	27.979495546715764
594	доказательство_s доказать_v необходимость_s пусть_part вектор_s	3	28.216714152270203
595	лемма_s доказать_partcp аналитический_a геометрия_s линейный_a	3	28.72330991930847
596	вектор_s линейно_adv независимый_a тогда_adv только_part	3	28.85444175404675
597	линейно_adv независимый_a тогда_adv только_part тогда_adv	3	29.34212235248712
598	независимый_a тогда_adv только_part тогда_adv когда_conj	3	29.4865122618223
599	линейно_adv зависимый_a аналитический_a геометрия_s линейный_a	3	29.829312188360618
600	зависимый_a аналитический_a геометрия_s линейный_a алгебра_s	3	28.360099548930734
601	геометрия_s линейный_a алгебра_s из_pr который_a	3	22.2879240365599
602	ортогональный_a проекция_s вектор_s на_pr ось_s	3	28.017005130094823
603	дан_s система_s координата_s на_pr плоскость_s	3	25.093492596945875
604	прямой_a аналитический_a геометрия_s линейный_a алгебра_s	3	25.356700972468868
605	уравнение_s в_pr декартовый_a система_s координата_s	3	22.29878090382655
606	нуль_s одновременно_adv число_s такой_a что_conj	3	25.281956277352162
607	система_s координата_s аналитический_a геометрия_s линейный_a	3	23.71022857822884
608	в_pr пространство_s геометрический_a возможный_a векторный_a	3	29.00548173182632
609	пространство_s геометрический_a возможный_a векторный_a форма_s	3	32.96765476293603
610	геометрический_a возможный_a векторный_a форма_s пред_pr	3	37.77031798966891
611	возможный_a векторный_a форма_s пред_pr условие_s	3	36.18535548894775
612	векторный_a форма_s пред_pr условие_s ставление_s	3	38.38175270175126
613	ортогональность_s прямой_a существовать_v такой_a что_conj	3	28.361698994756207
614	прямой_a существовать_v такой_a что_conj плоскость_s	3	23.456995958385452
615	определение_s быть_v говорить_v что_conj линия_s	3	25.669665956611443
616	векторфункция_s в_pr координатный_a форма_s где_adv	3	28.950610694826814
617	в_pr координатный_a форма_s где_adv непрерывный_a	3	26.129111590448943
618	координатный_a форма_s где_adv непрерывный_a скалярный_a	3	30.94153750205397
619	форма_s где_adv непрерывный_a скалярный_a функция_s	3	27.899387076834977
620	на_pr для_pr любой_a точка_s лежать_partcp	3	23.951537562784452
621	для_pr любой_a точка_s лежать_partcp на_pr	3	23.951537562784452
622	система_s координата_s иметь_v вид_s где_adv	3	22.92569699818981
623	радиус_s с_pr центр_s в_pr начало_s	3	29.49131004930208
624	такой_a что_conj глава_s преобразование_s плоскость_s	3	26.04835441986506
625	следствие_s доказать_partcp аналитический_a геометрия_s линейный_a	3	28.32939571159538
626	геометрия_s линейный_a алгебра_s теорема_s если_conj	3	22.00645974935007
627	теорема_s доказать_partcp теорема_s при_pr аффинный_a	3	26.866773485327435
628	доказать_partcp теорема_s при_pr аффинный_a преобразование_s	3	29.017937558661085
629	аналитический_a геометрия_s линейный_a алгебра_s пусть_part	3	24.849615264168854
630	к_pr базис_s в_pr который_a матрица_s	3	19.613172297657265
631	доказать_partcp л_sв_pr система_s линейный_a уравнение_s	3	24.060766803458986
632	аналитический_a геометрия_s линейный_a алгебра_s который_a	3	24.37721356979458
633	существовать_v равный_a нуль_s одновременно_adv число_s	3	27.355151746923447
634	по_pr правило_s действие_s с_pr матрица_s	3	26.94852374577603
635	частный_a решение_s неодно_adv родной_a система_s	3	36.90142959356312
636	аналитический_a геометрия_s линейный_a алгебра_s заметить_v	3	27.473310159378723
637	геометрия_s линейный_a алгебра_s заметить_v что_conj	3	24.759614344535365
638	аналитический_a геометрия_s линейный_a алгебра_s найти_v	3	25.394533045994603
639	состоять_partcp из_pr один_a нулевой_a элемент_s	3	28.80410628198969
640	теорема_s доказать_partcp теорема_s для_pr каждый_a	3	23.52690200502314
641	теорема_s для_pr каждый_a элемент_s линейный_a	3	20.953051436127804
642	для_pr каждый_a элемент_s линейный_a пространство_s	3	21.590313513680737
643	максимальный_a число_s линейно_adv независимый_a элемент_s	3	30.462987442734853
644	операция_s с_pr элемент_s линейный_a пространство_s	3	23.043687779191842
645	элемент_s аналитический_a геометрия_s линейный_a алгебра_s	3	24.516267359990387
646	линейный_a пространство_s аналитический_a геометрия_s линейный_a	3	22.986024980325485
647	иметь_v место_s равенство_s аналитический_a геометрия_s	3	26.995508836062037
648	место_s равенство_s аналитический_a геометрия_s линейный_a	3	26.35862891165671
649	в_pr линейный_a пространство_s функция_s иметь_partcp	3	22.28233290677445
650	линейный_a пространство_s функция_s иметь_partcp на_pr	3	23.323408849777366
651	с_pr линейный_a оператор_s в_pr матричный_a	3	22.651891475796578
652	система_s линейный_a уравнение_s общий_a решение_s	3	20.890882231195757
653	замечание_s о_pr важность_s собственный_a вектор_s	3	35.632590227106924
654	собственный_a значение_s глава_s линейный_a зависимость_s	3	29.19091926090094
655	значение_s глава_s линейный_a зависимость_s в_pr	3	25.188748161859316
656	таким образом_adv м приходить_v к_pr	3	32.74310958065134
657	оператор_s отвечать_partcp различный_a собственный_a значение_s	3	32.25946442895413
658	м приходить_v к_pr заключение_s что_conj	3	30.603981095166766
659	определение_s пусть_part в_pr линейный_a пространство_s	3	19.591092937073277
660	пусть_part в_pr линейный_a пространство_s каждый_a	3	20.354878844193482
661	функционал_s иметь_v диагональный_a канонический_a вид_s	3	30.017286009232325
662	инвариант_s линия_s второй_a порядок_s на_pr	3	30.04583935469113
663	уравнение_s линия_s второй_a порядок_s на_pr	3	23.283549604165056
664	квадратичный_a функционал_s иметь_v диагональный_a вид_s	3	28.961790896640622
665	что_conj скалярный_a произведение_s быть_v билинейный_a	3	27.474795238148655
666	теорема_s доказать_partcp л_sв_pr евклидов_a пространство_s	3	29.697866953816682
667	действовать_partcp в_pr унитарный_a пространство_s называться_v	3	28.77541044390696
668	окончательно_adv аналитический_a геометрия_s линейный_a алгебра_s	3	29.23003900836636
669	свойство_s определение_s линия_s уравнение_s который_a	3	23.72169853126282
670	линия_s уравнение_s который_a в_pr некоторый_a	3	21.629219915844477
671	система_s координата_s иметь_v вид_s называться_v	3	22.18435794090661
672	задать_partcp канонический_a уравнение_s тогда_adv иметь_v	3	25.78562506912469
673	канонический_a уравнение_s тогда_adv иметь_v место_s	3	25.869148424686976
674	уравнение_s тогда_adv иметь_v место_s следующий_a	3	24.42263269393496
675	тогда_adv иметь_v место_s следующий_a соотношение_s	3	27.74751713215374
676	проходить_partcp через_pr точка_s иметь_v вид_s	3	26.910223078680218
677	через_pr точка_s иметь_v вид_s доказательство_s	3	24.245643409895692
678	точка_s иметь_v вид_s доказательство_s уравнение_s	3	21.384891020483934
679	иметь_v вид_s доказательство_s уравнение_s касательная_s	3	25.775186445677484
680	вид_s доказательство_s уравнение_s касательная_s в_pr	3	23.68491865222696
681	доказательство_s уравнение_s касательная_s в_pr точка_s	3	22.419048680329077
682	уравнение_s касательная_s в_pr точка_s иметь_v	3	20.76631196313205
683	касательная_s в_pr точка_s иметь_v вид_s	3	22.48663842055443
684	в_pr точка_s иметь_v вид_s для_pr	3	18.180710804360785
685	из_pr канонический_a уравнение_s получать_v то	3	27.17376121700413
686	канонический_a уравнение_s получать_v то есть_adv	3	30.20646722187244
687	уравнение_s получать_v то есть_adv тогда_adv	3	27.3651649678915
688	получать_v то есть_adv тогда_adv принимать_v	3	31.682669875744676
689	то есть_adv тогда_adv принимать_v во_pr	3	32.288390936632624
690	окончательно_adv получить_v наконец_adv непосредственно_adv проверять_v	3	44.60879596506047
691	получить_v наконец_adv непосредственно_adv проверять_v утверждение_s	3	42.512580649801166
692	наконец_adv непосредственно_adv проверять_v утверждение_s теорема_s	3	41.194424308803015
693	непосредственно_adv проверять_v утверждение_s теорема_s для_pr	3	36.52895430592222
694	проверять_v утверждение_s теорема_s для_pr точка_s	3	30.3731241343657
695	утверждение_s теорема_s для_pr точка_s где_adv	3	23.33146498272848
696	теорема_s для_pr точка_s где_adv уравнение_s	3	19.353446541146972
697	прил_s следовать_v возможность_s альтернативный_a формулировка_s	3	42.225673437422344
698	следовать_v возможность_s альтернативный_a формулировка_s свойство_s	3	40.85150821955902
699	быть_v геометрический_a место_s точка_s отношение_s	3	29.214852724848654
700	геометрический_a место_s точка_s отношение_s расстояние_s	3	33.07417763720512
701	место_s точка_s отношение_s расстояние_s от_pr	3	31.053268647442135
702	точка_s отношение_s расстояние_s от_pr который_a	3	28.58086695306786
703	отношение_s расстояние_s от_pr который_a до_pr	3	31.81069770606817
704	который_a до_pr данный_a точка_s фокус_s	3	28.992892049923736
705	до_pr данный_a точка_s фокус_s к_pr	3	29.16066666336785
706	данный_a точка_s фокус_s к_pr расстояние_s	3	30.199140811182485
707	точка_s фокус_s к_pr расстояние_s до_pr	3	31.227337703013138
708	фокус_s к_pr расстояние_s до_pr данный_a	3	33.42897156418279
709	к_pr расстояние_s до_pr данный_a прямой_a	3	30.089969955936485
710	расстояние_s до_pr данный_a прямой_a директриса_s	3	35.7261111805832
711	до_pr данный_a прямой_a директриса_s постоянно_adv	3	39.935564546212156
712	с_pr фокальный_a радиус_s точка_s касание_s	3	37.062438657170325
713	в_pr полярный_a система_s координата_s поместить_v	3	30.374731133256386
714	полярный_a система_s координата_s поместить_v полюс_s	3	38.8774725457288
715	система_s координата_s поместить_v полюс_s полярный_a	3	38.8774725457288
716	координата_s поместить_v полюс_s полярный_a система_s	3	38.8774725457288
717	поместить_v полюс_s полярный_a система_s координата_s	3	38.8774725457288
718	полюс_s полярный_a система_s координата_s в_pr	3	29.722654436676695
719	для_pr произвольный_a точка_s лежать_partcp на_pr	3	25.76037445214329
720	откуда_adv окончательно_adv сравнить_v формула_s с_pr	3	36.294973955237715
721	окончательно_adv сравнить_v формула_s с_pr выкладка_s	3	40.83929447146152
722	сравнить_v формула_s с_pr выкладка_s в_pr	3	33.73510243547939
723	второй_a порядок_s на_pr плоскость_s доказательство_s	3	23.972311183547852
724	ось_s плоскостной_a симметрия_s относительно_pr координатный_a	3	41.77040118445114
725	плоскостной_a симметрия_s относительно_pr координатный_a плоскость_s	3	39.96850895366416
726	неограниченный_a поверхность_s поскольку_conj из_pr его_a	3	31.534083268426635
727	получаться_v эллипс_s плоскость_s ортогональный_a ось_s	3	33.0507858748447
728	эллипс_s плоскость_s ортогональный_a ось_s или_part	3	34.63574837556585
729	экспоненциальный_a форма_s запись_s комплексный_a число_s	3	34.23728537269636
730	произведение_s вектор_s в_pr координата_s выражение_s	3	22.609221887243223
731	произведение_s вектор_s в_pr ортонормированный_a система_s	3	21.905310974719686
732	вектор_s в_pr ортонормированный_a система_s координата_s	3	21.678177520391998
733	основной_a общематематический_a понятие_s обозначение_s множество_s	2	38.578066998664
734	композиция_s функция_s взаимно_adv обратный_a функция_s	2	31.07921910821764
